2025-12-08 07:34:15 | ⚔️ WAR GAME v2: GUARDRAILS ON ⚔️
2025-12-08 07:34:15 | ⚡ [SETUP] BTCUSDT Profile -> Env:COLD Status:APPROVED Score:80.0
2025-12-08 07:34:15 | ⚡ [SETUP] ETHUSDT Profile -> Env:HOT Status:REJECTED Score:80.0
2025-12-08 07:34:15 | ⚡ [SETUP] SOLUSDT Profile -> Env:HOT Status:APPROVED Score:95
2025-12-08 07:34:15 | Fleet: ['BTCUSDT', 'ETHUSDT', 'SOLUSDT']
2025-12-08 07:34:15 | Starting simulation...
2025-12-08 07:34:15 | [2025-10-29 20:00:00+00:00] BTCUSDT Signal Score:68.2 -> 🛑 BLOCK_RADAR_COLD
2025-12-08 07:34:15 | [2025-10-30 02:00:00+00:00] BTCUSDT Signal Score:54.5 -> 🛑 BLOCK_RADAR_COLD
2025-12-08 07:34:15 | [2025-10-30 05:00:00+00:00] BTCUSDT Signal Score:71.8 -> 🛑 BLOCK_RADAR_COLD
2025-12-08 07:34:15 | [2025-11-02 04:00:00+00:00] SOLUSDT Signal Score:72.5 -> ✅ ALLOW
2025-12-08 07:34:15 | [2025-11-02 07:00:00+00:00] SOLUSDT Signal Score:0.0 -> ✅ ALLOW
2025-12-08 07:34:15 | [2025-11-02 10:00:00+00:00] SOLUSDT Signal Score:0.0 -> ✅ ALLOW
2025-12-08 07:34:15 | [2025-11-02 13:00:00+00:00] SOLUSDT Signal Score:0.0 -> ✅ ALLOW
2025-12-08 07:34:15 | [2025-11-02 16:00:00+00:00] SOLUSDT Signal Score:0.0 -> ✅ ALLOW
2025-12-08 07:34:15 | [2025-11-02 18:00:00+00:00] ETHUSDT Signal Score:51.9 -> 🛑 BLOCK_STRATEGY_REJECTED
2025-12-08 07:34:15 | [2025-11-02 19:00:00+00:00] SOLUSDT Signal Score:0.0 -> ✅ ALLOW
2025-12-08 07:34:15 | [2025-11-02 22:00:00+00:00] SOLUSDT Signal Score:0.0 -> ✅ ALLOW
2025-12-08 07:34:15 | [2025-11-03 01:00:00+00:00] SOLUSDT Signal Score:0.0 -> ✅ ALLOW
2025-12-08 07:34:15 | [2025-11-03 04:00:00+00:00] SOLUSDT Signal Score:0.0 -> ✅ ALLOW
2025-12-08 07:34:15 | [2025-11-03 13:00:00+00:00] SOLUSDT Signal Score:54.7 -> ✅ ALLOW
2025-12-08 07:34:15 | [2025-11-03 16:00:00+00:00] SOLUSDT Signal Score:68.1 -> ✅ ALLOW
2025-12-08 07:34:15 | [2025-11-03 17:00:00+00:00] BTCUSDT Signal Score:68.8 -> 🛑 BLOCK_RADAR_COLD
2025-12-08 07:34:15 | [2025-11-03 19:00:00+00:00] SOLUSDT Signal Score:0.0 -> ✅ ALLOW
2025-12-08 07:34:15 | [2025-11-04 00:00:00+00:00] ETHUSDT Signal Score:55.6 -> 🛑 BLOCK_STRATEGY_REJECTED
2025-12-08 07:34:15 | [2025-11-04 14:00:00+00:00] BTCUSDT Signal Score:51.3 -> 🛑 BLOCK_RADAR_COLD
2025-12-08 07:34:15 | [2025-11-07 14:00:00+00:00] BTCUSDT Signal Score:51.9 -> 🛑 BLOCK_RADAR_COLD
2025-12-08 07:34:15 | [2025-11-12 08:00:00+00:00] BTCUSDT Signal Score:54.4 -> 🛑 BLOCK_RADAR_COLD
2025-12-08 07:34:15 | [2025-11-12 21:00:00+00:00] ETHUSDT Signal Score:50.8 -> 🛑 BLOCK_STRATEGY_REJECTED
2025-12-08 07:34:15 | [2025-11-13 05:00:00+00:00] BTCUSDT Signal Score:76.8 -> 🛑 BLOCK_RADAR_COLD
2025-12-08 07:34:15 | [2025-11-13 22:00:00+00:00] SOLUSDT Signal Score:83.9 -> ✅ ALLOW
2025-12-08 07:34:15 | [2025-11-14 01:00:00+00:00] SOLUSDT Signal Score:0.0 -> ✅ ALLOW
2025-12-08 07:34:15 | [2025-11-14 02:00:00+00:00] BTCUSDT Signal Score:55.1 -> 🛑 BLOCK_RADAR_COLD
2025-12-08 07:34:15 | [2025-11-14 04:00:00+00:00] SOLUSDT Signal Score:0.0 -> ✅ ALLOW
2025-12-08 07:34:15 | [2025-11-14 07:00:00+00:00] SOLUSDT Signal Score:0.0 -> ✅ ALLOW
2025-12-08 07:34:15 | [2025-11-14 08:00:00+00:00] BTCUSDT Signal Score:50.2 -> 🛑 BLOCK_RADAR_COLD
2025-12-08 07:34:15 | [2025-11-14 10:00:00+00:00] SOLUSDT Signal Score:0.0 -> ✅ ALLOW
2025-12-08 07:34:15 | [2025-11-14 13:00:00+00:00] SOLUSDT Signal Score:0.0 -> ✅ ALLOW
2025-12-08 07:34:15 | [2025-11-14 14:00:00+00:00] BTCUSDT Signal Score:69.9 -> 🛑 BLOCK_RADAR_COLD
2025-12-08 07:34:15 | [2025-11-14 16:00:00+00:00] SOLUSDT Signal Score:0.0 -> ✅ ALLOW
2025-12-08 07:34:15 | [2025-11-14 19:00:00+00:00] SOLUSDT Signal Score:0.0 -> ✅ ALLOW
2025-12-08 07:34:15 | [2025-11-14 22:00:00+00:00] SOLUSDT Signal Score:0.0 -> ✅ ALLOW
2025-12-08 07:34:15 | [2025-11-15 00:00:00+00:00] ETHUSDT Signal Score:77.4 -> 🛑 BLOCK_STRATEGY_REJECTED
2025-12-08 07:34:15 | [2025-11-15 01:00:00+00:00] SOLUSDT Signal Score:0.0 -> ✅ ALLOW
2025-12-08 07:34:15 | [2025-11-15 04:00:00+00:00] SOLUSDT Signal Score:0.0 -> ✅ ALLOW
2025-12-08 07:34:15 | [2025-11-15 07:00:00+00:00] SOLUSDT Signal Score:0.0 -> ✅ ALLOW
2025-12-08 07:34:15 | [2025-11-15 10:00:00+00:00] SOLUSDT Signal Score:0.0 -> ✅ ALLOW
2025-12-08 07:34:15 | [2025-11-15 13:00:00+00:00] SOLUSDT Signal Score:0.0 -> ✅ ALLOW
2025-12-08 07:34:15 | [2025-11-15 16:00:00+00:00] SOLUSDT Signal Score:0.0 -> ✅ ALLOW
2025-12-08 07:34:15 | [2025-11-15 19:00:00+00:00] SOLUSDT Signal Score:0.0 -> ✅ ALLOW
2025-12-08 07:34:15 | [2025-11-15 22:00:00+00:00] SOLUSDT Signal Score:0.0 -> ✅ ALLOW
2025-12-08 07:34:15 | [2025-11-16 01:00:00+00:00] SOLUSDT Signal Score:0.0 -> ✅ ALLOW
2025-12-08 07:34:15 | [2025-11-16 02:00:00+00:00] BTCUSDT Signal Score:69.2 -> 🛑 BLOCK_RADAR_COLD
2025-12-08 07:34:15 | [2025-11-16 04:00:00+00:00] SOLUSDT Signal Score:0.0 -> ✅ ALLOW
2025-12-08 07:34:15 | [2025-11-16 07:00:00+00:00] SOLUSDT Signal Score:0.0 -> ✅ ALLOW
2025-12-08 07:34:15 | [2025-11-16 10:00:00+00:00] SOLUSDT Signal Score:0.0 -> ✅ ALLOW
2025-12-08 07:34:15 | [2025-11-16 13:00:00+00:00] SOLUSDT Signal Score:0.0 -> ✅ ALLOW
2025-12-08 07:34:15 | [2025-11-16 14:00:00+00:00] BTCUSDT Signal Score:53.8 -> 🛑 BLOCK_RADAR_COLD
2025-12-08 07:34:15 | [2025-11-16 16:00:00+00:00] SOLUSDT Signal Score:0.0 -> ✅ ALLOW
2025-12-08 07:34:15 | [2025-11-16 19:00:00+00:00] SOLUSDT Signal Score:59.8 -> ✅ ALLOW
2025-12-08 07:34:15 | [2025-11-16 22:00:00+00:00] SOLUSDT Signal Score:71.7 -> ✅ ALLOW
2025-12-08 07:34:15 | [2025-11-17 01:00:00+00:00] SOLUSDT Signal Score:0.0 -> ✅ ALLOW
2025-12-08 07:34:15 | [2025-11-17 04:00:00+00:00] SOLUSDT Signal Score:0.0 -> ✅ ALLOW
2025-12-08 07:34:15 | [2025-11-17 07:00:00+00:00] SOLUSDT Signal Score:0.0 -> ✅ ALLOW
2025-12-08 07:34:15 | [2025-11-17 10:00:00+00:00] SOLUSDT Signal Score:0.0 -> ✅ ALLOW
2025-12-08 07:34:15 | [2025-11-17 13:00:00+00:00] SOLUSDT Signal Score:0.0 -> ✅ ALLOW
2025-12-08 07:34:15 | [2025-11-17 14:00:00+00:00] BTCUSDT Signal Score:63.2 -> 🛑 BLOCK_RADAR_COLD
2025-12-08 07:34:15 | [2025-11-17 16:00:00+00:00] SOLUSDT Signal Score:0.0 -> ✅ ALLOW
2025-12-08 07:34:15 | [2025-11-17 19:00:00+00:00] SOLUSDT Signal Score:0.0 -> ✅ ALLOW
2025-12-08 07:34:15 | [2025-11-17 22:00:00+00:00] SOLUSDT Signal Score:64.4 -> ✅ ALLOW
2025-12-08 07:34:15 | [2025-11-18 01:00:00+00:00] SOLUSDT Signal Score:0.0 -> ✅ ALLOW
2025-12-08 07:34:15 | [2025-11-18 03:00:00+00:00] ETHUSDT Signal Score:87.6 -> 🛑 BLOCK_STRATEGY_REJECTED
2025-12-08 07:34:15 | [2025-11-18 04:00:00+00:00] SOLUSDT Signal Score:0.0 -> ✅ ALLOW
2025-12-08 07:34:15 | [2025-11-18 07:00:00+00:00] SOLUSDT Signal Score:0.0 -> ✅ ALLOW
2025-12-08 07:34:15 | [2025-11-18 08:00:00+00:00] BTCUSDT Signal Score:73.4 -> 🛑 BLOCK_RADAR_COLD
2025-12-08 07:34:15 | [2025-11-18 10:00:00+00:00] SOLUSDT Signal Score:0.0 -> ✅ ALLOW
2025-12-08 07:34:15 | [2025-11-18 13:00:00+00:00] SOLUSDT Signal Score:0.0 -> ✅ ALLOW
2025-12-08 07:34:15 | [2025-11-18 16:00:00+00:00] SOLUSDT Signal Score:0.0 -> ✅ ALLOW
2025-12-08 07:34:15 | [2025-11-18 19:00:00+00:00] SOLUSDT Signal Score:0.0 -> ✅ ALLOW
2025-12-08 07:34:15 | [2025-11-18 22:00:00+00:00] SOLUSDT Signal Score:0.0 -> ✅ ALLOW
2025-12-08 07:34:15 | [2025-11-19 01:00:00+00:00] SOLUSDT Signal Score:0.0 -> ✅ ALLOW
2025-12-08 07:34:15 | [2025-11-19 04:00:00+00:00] SOLUSDT Signal Score:0.0 -> ✅ ALLOW
2025-12-08 07:34:15 | [2025-11-19 07:00:00+00:00] SOLUSDT Signal Score:0.0 -> ✅ ALLOW
2025-12-08 07:34:15 | [2025-11-19 10:00:00+00:00] SOLUSDT Signal Score:0.0 -> ✅ ALLOW
2025-12-08 07:34:15 | [2025-11-19 13:00:00+00:00] SOLUSDT Signal Score:0.0 -> ✅ ALLOW
2025-12-08 07:34:15 | [2025-11-19 16:00:00+00:00] SOLUSDT Signal Score:0.0 -> ✅ ALLOW
2025-12-08 07:34:15 | [2025-11-19 19:00:00+00:00] SOLUSDT Signal Score:0.0 -> ✅ ALLOW
2025-12-08 07:34:15 | [2025-11-19 22:00:00+00:00] SOLUSDT Signal Score:0.0 -> ✅ ALLOW
2025-12-08 07:34:15 | [2025-11-20 01:00:00+00:00] SOLUSDT Signal Score:0.0 -> ✅ ALLOW
2025-12-08 07:34:15 | [2025-11-20 04:00:00+00:00] SOLUSDT Signal Score:0.0 -> ✅ ALLOW
2025-12-08 07:34:15 | [2025-11-20 07:00:00+00:00] SOLUSDT Signal Score:0.0 -> ✅ ALLOW
2025-12-08 07:34:15 | [2025-11-20 10:00:00+00:00] SOLUSDT Signal Score:0.0 -> ✅ ALLOW
2025-12-08 07:34:15 | [2025-11-20 13:00:00+00:00] SOLUSDT Signal Score:0.0 -> ✅ ALLOW
2025-12-08 07:34:15 | [2025-11-20 16:00:00+00:00] SOLUSDT Signal Score:0.0 -> ✅ ALLOW
2025-12-08 07:34:15 | [2025-11-20 19:00:00+00:00] SOLUSDT Signal Score:0.0 -> ✅ ALLOW
2025-12-08 07:34:15 | [2025-11-20 22:00:00+00:00] SOLUSDT Signal Score:0.0 -> ✅ ALLOW
2025-12-08 07:34:15 | [2025-11-21 01:00:00+00:00] SOLUSDT Signal Score:0.0 -> ✅ ALLOW
2025-12-08 07:34:15 | [2025-11-21 04:00:00+00:00] SOLUSDT Signal Score:0.0 -> ✅ ALLOW
2025-12-08 07:34:15 | [2025-11-21 07:00:00+00:00] SOLUSDT Signal Score:0.0 -> ✅ ALLOW
2025-12-08 07:34:15 | [2025-11-21 10:00:00+00:00] SOLUSDT Signal Score:0.0 -> ✅ ALLOW
2025-12-08 07:34:15 | [2025-11-21 13:00:00+00:00] SOLUSDT Signal Score:0.0 -> ✅ ALLOW
2025-12-08 07:34:15 | [2025-11-21 16:00:00+00:00] SOLUSDT Signal Score:0.0 -> ✅ ALLOW
2025-12-08 07:34:15 | [2025-11-21 19:00:00+00:00] SOLUSDT Signal Score:0.0 -> ✅ ALLOW
2025-12-08 07:34:15 | [2025-11-21 22:00:00+00:00] SOLUSDT Signal Score:0.0 -> ✅ ALLOW
2025-12-08 07:34:15 | [2025-11-22 01:00:00+00:00] SOLUSDT Signal Score:0.0 -> ✅ ALLOW
2025-12-08 07:34:15 | [2025-11-22 04:00:00+00:00] SOLUSDT Signal Score:0.0 -> ✅ ALLOW
2025-12-08 07:34:15 | [2025-11-22 07:00:00+00:00] SOLUSDT Signal Score:0.0 -> ✅ ALLOW
2025-12-08 07:34:15 | [2025-11-22 10:00:00+00:00] SOLUSDT Signal Score:0.0 -> ✅ ALLOW
2025-12-08 07:34:15 | [2025-11-22 13:00:00+00:00] SOLUSDT Signal Score:0.0 -> ✅ ALLOW
2025-12-08 07:34:15 | [2025-11-22 16:00:00+00:00] SOLUSDT Signal Score:0.0 -> ✅ ALLOW
2025-12-08 07:34:15 | [2025-11-22 19:00:00+00:00] SOLUSDT Signal Score:0.0 -> ✅ ALLOW
2025-12-08 07:34:15 | [2025-11-22 22:00:00+00:00] SOLUSDT Signal Score:0.0 -> ✅ ALLOW
2025-12-08 07:34:15 | [2025-11-23 01:00:00+00:00] SOLUSDT Signal Score:0.0 -> ✅ ALLOW
2025-12-08 07:34:15 | [2025-11-23 04:00:00+00:00] SOLUSDT Signal Score:0.0 -> ✅ ALLOW
2025-12-08 07:34:15 | [2025-11-23 07:00:00+00:00] SOLUSDT Signal Score:0.0 -> ✅ ALLOW
2025-12-08 07:34:15 | [2025-11-23 10:00:00+00:00] SOLUSDT Signal Score:0.0 -> ✅ ALLOW
2025-12-08 07:34:15 | [2025-11-23 13:00:00+00:00] SOLUSDT Signal Score:0.0 -> ✅ ALLOW
2025-12-08 07:34:15 | [2025-11-23 16:00:00+00:00] SOLUSDT Signal Score:0.0 -> ✅ ALLOW
2025-12-08 07:34:15 | [2025-11-23 19:00:00+00:00] SOLUSDT Signal Score:0.0 -> ✅ ALLOW
2025-12-08 07:34:15 | [2025-11-23 22:00:00+00:00] SOLUSDT Signal Score:0.0 -> ✅ ALLOW
2025-12-08 07:34:15 | [2025-11-24 01:00:00+00:00] SOLUSDT Signal Score:0.0 -> ✅ ALLOW
2025-12-08 07:34:15 | [2025-11-24 04:00:00+00:00] SOLUSDT Signal Score:0.0 -> ✅ ALLOW
2025-12-08 07:34:15 | [2025-11-24 07:00:00+00:00] SOLUSDT Signal Score:0.0 -> ✅ ALLOW
2025-12-08 07:34:15 | [2025-11-24 10:00:00+00:00] SOLUSDT Signal Score:0.0 -> ✅ ALLOW
2025-12-08 07:34:15 | [2025-11-24 13:00:00+00:00] SOLUSDT Signal Score:0.0 -> ✅ ALLOW
2025-12-08 07:34:15 | [2025-11-24 16:00:00+00:00] SOLUSDT Signal Score:0.0 -> ✅ ALLOW
2025-12-08 07:34:15 | [2025-11-24 19:00:00+00:00] SOLUSDT Signal Score:0.0 -> ✅ ALLOW
2025-12-08 07:34:15 | [2025-11-24 22:00:00+00:00] SOLUSDT Signal Score:0.0 -> ✅ ALLOW
2025-12-08 07:34:15 | [2025-11-25 01:00:00+00:00] SOLUSDT Signal Score:0.0 -> ✅ ALLOW
2025-12-08 07:34:15 | [2025-11-25 04:00:00+00:00] SOLUSDT Signal Score:0.0 -> ✅ ALLOW
2025-12-08 07:34:15 | [2025-11-25 07:00:00+00:00] SOLUSDT Signal Score:0.0 -> ✅ ALLOW
2025-12-08 07:34:15 | [2025-11-25 10:00:00+00:00] SOLUSDT Signal Score:0.0 -> ✅ ALLOW
2025-12-08 07:34:15 | [2025-11-25 13:00:00+00:00] SOLUSDT Signal Score:0.0 -> ✅ ALLOW
2025-12-08 07:34:15 | [2025-11-25 16:00:00+00:00] SOLUSDT Signal Score:0.0 -> ✅ ALLOW
2025-12-08 07:34:15 | [2025-11-25 19:00:00+00:00] SOLUSDT Signal Score:0.0 -> ✅ ALLOW
2025-12-08 07:34:15 | [2025-11-25 22:00:00+00:00] SOLUSDT Signal Score:0.0 -> ✅ ALLOW
2025-12-08 07:34:15 | [2025-11-26 01:00:00+00:00] SOLUSDT Signal Score:0.0 -> ✅ ALLOW
2025-12-08 07:34:15 | [2025-11-26 04:00:00+00:00] SOLUSDT Signal Score:0.0 -> ✅ ALLOW
2025-12-08 07:34:15 | [2025-11-26 07:00:00+00:00] SOLUSDT Signal Score:0.0 -> ✅ ALLOW
2025-12-08 07:34:15 | [2025-11-26 10:00:00+00:00] SOLUSDT Signal Score:0.0 -> ✅ ALLOW
2025-12-08 07:34:15 | [2025-11-26 13:00:00+00:00] SOLUSDT Signal Score:0.0 -> ✅ ALLOW
2025-12-08 07:34:15 | [2025-11-26 16:00:00+00:00] SOLUSDT Signal Score:0.0 -> ✅ ALLOW
2025-12-08 07:34:15 | [2025-11-26 19:00:00+00:00] SOLUSDT Signal Score:0.0 -> ✅ ALLOW
2025-12-08 07:34:15 | [2025-11-26 22:00:00+00:00] SOLUSDT Signal Score:0.0 -> ✅ ALLOW
2025-12-08 07:34:15 | [2025-11-27 01:00:00+00:00] SOLUSDT Signal Score:0.0 -> ✅ ALLOW
2025-12-08 07:34:15 | [2025-11-27 04:00:00+00:00] SOLUSDT Signal Score:0.0 -> ✅ ALLOW
2025-12-08 07:34:15 | [2025-11-27 07:00:00+00:00] SOLUSDT Signal Score:0.0 -> ✅ ALLOW
2025-12-08 07:34:15 | [2025-11-27 10:00:00+00:00] SOLUSDT Signal Score:0.0 -> ✅ ALLOW
2025-12-08 07:34:15 | [2025-11-27 13:00:00+00:00] SOLUSDT Signal Score:0.0 -> ✅ ALLOW
2025-12-08 07:34:15 | [2025-11-27 16:00:00+00:00] SOLUSDT Signal Score:0.0 -> ✅ ALLOW
2025-12-08 07:34:15 | [2025-11-27 19:00:00+00:00] SOLUSDT Signal Score:0.0 -> ✅ ALLOW
2025-12-08 07:34:15 | [2025-11-27 22:00:00+00:00] SOLUSDT Signal Score:0.0 -> ✅ ALLOW
2025-12-08 07:34:15 | [2025-11-28 01:00:00+00:00] SOLUSDT Signal Score:0.0 -> ✅ ALLOW
2025-12-08 07:34:15 | [2025-11-28 04:00:00+00:00] SOLUSDT Signal Score:0.0 -> ✅ ALLOW
2025-12-08 07:34:15 | [2025-11-28 07:00:00+00:00] SOLUSDT Signal Score:0.0 -> ✅ ALLOW
2025-12-08 07:34:15 | [2025-11-28 10:00:00+00:00] SOLUSDT Signal Score:0.0 -> ✅ ALLOW
2025-12-08 07:34:15 | [2025-11-28 13:00:00+00:00] SOLUSDT Signal Score:0.0 -> ✅ ALLOW
2025-12-08 07:34:15 | [2025-11-28 16:00:00+00:00] SOLUSDT Signal Score:0.0 -> ✅ ALLOW
2025-12-08 07:34:15 | [2025-11-28 19:00:00+00:00] SOLUSDT Signal Score:0.0 -> ✅ ALLOW
2025-12-08 07:34:15 | [2025-11-28 22:00:00+00:00] SOLUSDT Signal Score:0.0 -> ✅ ALLOW
2025-12-08 07:34:15 | [2025-11-29 01:00:00+00:00] SOLUSDT Signal Score:0.0 -> ✅ ALLOW
2025-12-08 07:34:15 | [2025-11-29 04:00:00+00:00] SOLUSDT Signal Score:0.0 -> ✅ ALLOW
2025-12-08 07:34:15 | [2025-11-29 07:00:00+00:00] SOLUSDT Signal Score:0.0 -> ✅ ALLOW
2025-12-08 07:34:15 | [2025-11-29 10:00:00+00:00] SOLUSDT Signal Score:0.0 -> ✅ ALLOW
2025-12-08 07:34:15 | [2025-11-29 13:00:00+00:00] SOLUSDT Signal Score:0.0 -> ✅ ALLOW
2025-12-08 07:34:15 | [2025-11-29 16:00:00+00:00] SOLUSDT Signal Score:0.0 -> ✅ ALLOW
2025-12-08 07:34:15 | [2025-11-29 19:00:00+00:00] SOLUSDT Signal Score:0.0 -> ✅ ALLOW
2025-12-08 07:34:15 | [2025-11-29 22:00:00+00:00] SOLUSDT Signal Score:0.0 -> ✅ ALLOW
2025-12-08 07:34:15 | [2025-11-30 01:00:00+00:00] SOLUSDT Signal Score:0.0 -> ✅ ALLOW
2025-12-08 07:34:15 | [2025-11-30 04:00:00+00:00] SOLUSDT Signal Score:0.0 -> ✅ ALLOW
2025-12-08 07:34:15 | [2025-11-30 07:00:00+00:00] SOLUSDT Signal Score:0.0 -> ✅ ALLOW
2025-12-08 07:34:15 | [2025-11-30 10:00:00+00:00] SOLUSDT Signal Score:0.0 -> ✅ ALLOW
2025-12-08 07:34:15 | [2025-11-30 12:00:00+00:00] ETHUSDT Signal Score:72.1 -> 🛑 BLOCK_STRATEGY_REJECTED
2025-12-08 07:34:15 | [2025-11-30 13:00:00+00:00] SOLUSDT Signal Score:0.0 -> ✅ ALLOW
2025-12-08 07:34:15 | [2025-11-30 16:00:00+00:00] SOLUSDT Signal Score:0.0 -> ✅ ALLOW
2025-12-08 07:34:15 | [2025-11-30 19:00:00+00:00] SOLUSDT Signal Score:0.0 -> ✅ ALLOW
2025-12-08 07:34:15 | [2025-11-30 22:00:00+00:00] SOLUSDT Signal Score:0.0 -> ✅ ALLOW
2025-12-08 07:34:15 | [2025-12-01 01:00:00+00:00] SOLUSDT Signal Score:0.0 -> ✅ ALLOW
2025-12-08 07:34:15 | [2025-12-01 04:00:00+00:00] SOLUSDT Signal Score:0.0 -> ✅ ALLOW
2025-12-08 07:34:15 | [2025-12-01 07:00:00+00:00] SOLUSDT Signal Score:0.0 -> ✅ ALLOW
2025-12-08 07:34:15 | [2025-12-01 10:00:00+00:00] SOLUSDT Signal Score:0.0 -> ✅ ALLOW
2025-12-08 07:34:15 | [2025-12-01 13:00:00+00:00] SOLUSDT Signal Score:0.0 -> ✅ ALLOW
2025-12-08 07:34:15 | [2025-12-01 14:00:00+00:00] BTCUSDT Signal Score:51.6 -> 🛑 BLOCK_RADAR_COLD
2025-12-08 07:34:15 | [2025-12-01 16:00:00+00:00] SOLUSDT Signal Score:0.0 -> ✅ ALLOW
2025-12-08 07:34:15 | [2025-12-01 20:00:00+00:00] BTCUSDT Signal Score:67.4 -> 🛑 BLOCK_RADAR_COLD
2025-12-08 07:34:15 | [2025-12-04 20:00:00+00:00] BTCUSDT Signal Score:64.5 -> 🛑 BLOCK_RADAR_COLD
2025-12-08 07:34:15 | [2025-12-05 22:00:00+00:00] SOLUSDT Signal Score:50.7 -> ✅ ALLOW
2025-12-08 07:34:15 | [2025-12-06 01:00:00+00:00] SOLUSDT Signal Score:0.0 -> ✅ ALLOW
2025-12-08 07:34:15 | [2025-12-06 02:00:00+00:00] BTCUSDT Signal Score:50.5 -> 🛑 BLOCK_RADAR_COLD
2025-12-08 07:34:15 | [2025-12-06 04:00:00+00:00] SOLUSDT Signal Score:0.0 -> ✅ ALLOW
2025-12-08 07:34:15 | [2025-12-06 07:00:00+00:00] SOLUSDT Signal Score:0.0 -> ✅ ALLOW
2025-12-08 07:34:15 | [2025-12-06 09:00:00+00:00] ETHUSDT Signal Score:52.4 -> 🛑 BLOCK_STRATEGY_REJECTED
2025-12-08 07:34:15 | [2025-12-06 10:00:00+00:00] SOLUSDT Signal Score:50.5 -> ✅ ALLOW
2025-12-08 07:34:15 | [2025-12-06 13:00:00+00:00] SOLUSDT Signal Score:0.0 -> ✅ ALLOW
2025-12-08 07:34:15 | [2025-12-06 16:00:00+00:00] SOLUSDT Signal Score:0.0 -> ✅ ALLOW
2025-12-08 07:34:15 | [2025-12-06 19:00:00+00:00] SOLUSDT Signal Score:0.0 -> ✅ ALLOW
2025-12-08 07:34:15 | [2025-12-06 22:00:00+00:00] SOLUSDT Signal Score:0.0 -> ✅ ALLOW
2025-12-08 07:34:15 | [2025-12-07 01:00:00+00:00] SOLUSDT Signal Score:0.0 -> ✅ ALLOW
2025-12-08 07:34:15 | [2025-12-07 02:00:00+00:00] BTCUSDT Signal Score:59.3 -> 🛑 BLOCK_RADAR_COLD
2025-12-08 07:34:15 | [2025-12-07 04:00:00+00:00] SOLUSDT Signal Score:0.0 -> ✅ ALLOW
2025-12-08 07:34:15 | [2025-12-07 07:00:00+00:00] SOLUSDT Signal Score:0.0 -> ✅ ALLOW
2025-12-08 07:34:15 | [2025-12-07 10:00:00+00:00] SOLUSDT Signal Score:0.0 -> ✅ ALLOW
2025-12-08 07:34:15 | ----------------------------------------
2025-12-08 07:34:15 | 🏁 WAR GAME v2 RESULTS
2025-12-08 07:34:15 | ----------------------------------------
2025-12-08 07:34:15 | Total Signals Detected: 195
2025-12-08 07:34:15 | Guardrail Decisions:
2025-12-08 07:34:15 |   - BLOCK_RADAR_COLD: 20
2025-12-08 07:34:15 |   - ALLOW: 168
2025-12-08 07:34:15 |   - BLOCK_STRATEGY_REJECTED: 7
2025-12-08 07:34:15 | ----------------------------------------
2025-12-08 07:34:15 | Net PnL: $-1423.14
2025-12-08 07:34:15 | Trades Opened: 1
2025-12-08 07:34:15 | Trade History: 11
